{"activity":"snapshot-seal","actor":"AXIOM","claim_ceiling":"C1","event_id":"NEXUS_RPE_20260901T040301Z_8b5a13d4","event_type":"SNAPSHOT_SEALED","evidence_refs":["research/pipeline/packages/2026/09/NEXUS_RP_20260901T035600Z_retroactive-symbiotic-backfill_6f1a9c27/snapshots/v1"],"new_state":"READY_FOR_CURSOR","notes":["Source-root contents are intentionally not represented as verified bytes in v1."],"package_id":"NEXUS_RP_20260901T035600Z_retroactive-symbiotic-backfill_6f1a9c27","prior_state":"READY_FOR_CURSOR","recorded_at_utc":"2026-09-01T04:03:01Z","schema_version":"1.0.0","subject_refs":["NEXUS_RP_20260901T035600Z_retroactive-symbiotic-backfill_6f1a9c27:v1"]}
