{"activity":"seal-bundled-cursor-intake-v2","actor":"AXIOM","claim_ceiling":"C1","event_id":"NEXUS_RPE_20260901T122400Z_v2ready","event_type":"SNAPSHOT_SEALED","evidence_refs":["research/pipeline/packages/2026/09/NEXUS_RP_20260901T035600Z_retroactive-symbiotic-backfill_6f1a9c27/snapshots/v2","research/pipeline/packages/2026/09/NEXUS_RP_20260901T035600Z_retroactive-symbiotic-backfill_6f1a9c27/snapshots/v2/SHA256SUMS.txt"],"new_state":"READY_FOR_CURSOR","notes":["Operator explicitly returned Cursor to maximal onboard status and authorized the bundled intake.","Snapshot v2 preserves v1 and adds A90/R5/GitHub-bridge processing requirements.","Cursor, not AXIOM, must create the CURSOR_PROCESSING transition after verifying v2.","GitHub PR conversation is live transport only; canonical material changes remain event/snapshot bound."],"package_id":"NEXUS_RP_20260901T035600Z_retroactive-symbiotic-backfill_6f1a9c27","prior_state":"READY_FOR_CURSOR","recorded_at_utc":"2026-09-01T12:24:00Z","schema_version":"1.0.0","subject_refs":["snapshots/v2","NEXUS_OMEGA_CURSOR_FULL_BUNDLED_RESEARCH_INTAKE_A90_R5_GITHUB_BRIDGE_ORDER_20260901_R0"]}
