{"activity":"seal-for-cursor","actor":"AXIOM","claim_ceiling":"C1","event_id":"NEXUS_RPE_20260901T040300Z_2d7ce948","event_type":"STATE_CHANGED","evidence_refs":["research/pipeline/packages/2026/09/NEXUS_RP_20260901T035600Z_retroactive-symbiotic-backfill_6f1a9c27/snapshots/v1"],"new_state":"READY_FOR_CURSOR","notes":["Snapshot v1 is an intake/backfill order; READY_FOR_CURSOR does not mean locally validated."],"package_id":"NEXUS_RP_20260901T035600Z_retroactive-symbiotic-backfill_6f1a9c27","prior_state":"INTAKE","recorded_at_utc":"2026-09-01T04:03:00Z","schema_version":"1.0.0","subject_refs":["NEXUS_RP_20260901T035600Z_retroactive-symbiotic-backfill_6f1a9c27"]}
